202;A-05-01-02-006-001-02-1;SERVICIOS DE VENTA AL POR MAYOR PRESTADOS A COMISION O POR CONTRATA DE PRODUCTOS AGROPECUARIOS, UTILIZADOS PRINCIPALMENTE COMO MATERIAS PRIMAS, Y DE ANIMALES VIVOS;0000-00-00 00:00:00;0000-00-00 00:00:00;41
203;A-05-01-02-006-001-02-2;SERVICIOS DE VENTA AL POR MAYOR PRESTADOS A COMISION O POR CONTRATA DE ALIMENTOS, BEBIDAS Y TABACO;0000-00-00 00:00:00;0000-00-00 00:00:00;41
204;A-05-01-02-006-001-02-3;SERVICIOS DE VENTA AL POR MAYOR PRESTADOS A COMISION O POR CONTRATA DE TEXTILES, PRENDAS DE VESTIR Y CALZADO;0000-00-00 00:00:00;0000-00-00 00:00:00;41
205;A-05-01-02-006-001-02-4;SERVICIOS DE VENTA AL POR MAYOR PRESTADOS A COMISION O POR CONTRATA DE ELECTRODOMESTICOS, ARTICULOS Y EQUIPOS DOMESTICOS;0000-00-00 00:00:00;0000-00-00 00:00:00;41
206;A-05-01-02-006-001-02-5;SERVICIOS DE VENTA AL POR MAYOR PRESTADOS A COMISION O POR CONTRATA DE PRODUCTOS DIVERSOS DE CONSUMO;0000-00-00 00:00:00;0000-00-00 00:00:00;41
207;A-05-01-02-006-001-02-6;SERVICIOS DE VENTA AL POR MAYOR PRESTADOS A COMISION O POR CONTRATA DE MATERIALES DE CONSTRUCCION Y FERRETERIA;0000-00-00 00:00:00;0000-00-00 00:00:00;41
208;A-05-01-02-006-001-02-7;SERVICIOS DE VENTA AL POR MAYOR PRESTADOS A COMISION O POR CONTRATA DE PRODUCTOS QUIMICOS Y FARMACEUTICOS;0000-00-00 00:00:00;0000-00-00 00:00:00;41
209;A-05-01-02-006-001-02-8;SERVICIOS DE VENTA AL POR MAYOR PRESTADOS A COMISION O POR CONTRATA DE MAQUINARIA, EQUIPO Y SUMINISTROS;0000-00-00 00:00:00;0000-00-00 00:00:00;41
210;A-05-01-02-006-001-02-9;SERVICIOS DE VENTA AL POR MAYOR PRESTADOS A COMISION O POR CONTRATA DE OTROS PRODUCTOS;0000-00-00 00:00:00;0000-00-00 00:00:00;41
211;A-05-01-02-006-002-01;SERVICIOS DE VENTA AL POR MENOR EN ESTABLECIMIENTOS NO ESPECIALIZADOS;0000-00-00 00:00:00;0000-00-00 00:00:00;42
212;A-05-01-02-006-002-01-1;SERVICIOS DE VENTA AL POR MENOR DE PRODUCTOS AGROPECUARIOS UTILIZADOS PRINCIPALMENTE COMO MATERIAS PRIMAS, Y DE ANIMALES VIVOS, EN ESTABLECIMIENTOS NO ESPECIALIZADOS;0000-00-00 00:00:00;0000-00-00 00:00:00;42
213;A-05-01-02-006-002-01-2;SERVICIOS DE VENTA AL POR MENOR, DE ALIMENTOS, BEBIDAS Y TABACO, EN ESTABLECIMIENTOS NO ESPECIALIZADOS;0000-00-00 00:00:00;0000-00-00 00:00:00;42
214;A-05-01-02-006-002-01-3;SERVICIOS DE VENTA AL POR MENOR, DE ARTICULOS TEXTILES, PRENDAS DE VESTIR Y CALZADO, EN ESTABLECIMIENTOS NO ESPECIALIZADOS;0000-00-00 00:00:00;0000-00-00 00:00:00;42
215;A-05-01-02-006-002-01-4;SERVICIOS DE VENTA AL POR MENOR DE ELECTRODOMESTICOS, ARTICULOS Y EQUIPOS DOMESTICOS, EN ESTABLECIMIENTOS NO ESPECIALIZADOS;0000-00-00 00:00:00;0000-00-00 00:00:00;42
216;A-05-01-02-006-002-01-5;SERVICIOS DE VENTA AL POR MENOR DE PRODUCTOS DIVERSOS DE CONSUMO, EN ESTABLECIMIENTOS NO ESPECIALIZADOS;0000-00-00 00:00:00;0000-00-00 00:00:00;42
217;A-05-01-02-006-002-01-6;SERVICIOS DE VENTA AL POR MENOR DE MATERIALES DE CONSTRUCCION Y FERRETERIA, EN ESTABLECIMIENTOS NO ESPECIALIZADOS;0000-00-00 00:00:00;0000-00-00 00:00:00;42
218;A-05-01-02-006-002-01-7;SERVICIOS DE VENTA AL POR MENOR DE PRODUCTOS QUIMICOS Y FARMACEUTICOS, EN ESTABLECIMIENTOS NO ESPECIALIZADOS;0000-00-00 00:00:00;0000-00-00 00:00:00;42
219;A-05-01-02-006-002-01-8;SERVICIOS DE VENTA AL POR MENOR DE MAQUINARIA, EQUIPO Y SUMINISTROS, EN ESTABLECIMIENTOS NO ESPECIALIZADOS;0000-00-00 00:00:00;0000-00-00 00:00:00;42
220;A-05-01-02-006-002-01-9;SERVICIOS DE VENTA AL POR MENOR DE OTROS PRODUCTOS, EN ESTABLECIMIENTOS NO ESPECIALIZADOS;0000-00-00 00:00:00;0000-00-00 00:00:00;42
221;A-05-01-02-006-002-02;SERVICIOS DE VENTA AL POR MENOR EN ESTABLECIMIENTOS ESPECIALIZADOS;0000-00-00 00:00:00;0000-00-00 00:00:00;42
222;A-05-01-02-006-002-02-1;SERVICIOS DE VENTA AL POR MENOR DE PRODUCTOS AGROPECUARIOS , UTILIZADOS PRINCIPALMENTE COMO MATERIAS PRIMAS, Y DE ANIMALES VIVOS EN ESTABLECIMIENTOS ESPECIALIZADOS;0000-00-00 00:00:00;0000-00-00 00:00:00;42
223;A-05-01-02-006-002-02-2;SERVICIOS DE VENTA AL POR MENOR DE ALIMENTOS, BEBIDAS Y TABACO EN ESTABLECIMIENTOS ESPECIALIZADOS;0000-00-00 00:00:00;0000-00-00 00:00:00;42
224;A-05-01-02-006-002-02-3;SERVICIOS DE VENTA AL POR MENOR DE ARTICULOS TEXTILES, PRENDAS DE VESTIR Y CALZADO EN ESTABLECIMIENTOS ESPECIALIZADOS;0000-00-00 00:00:00;0000-00-00 00:00:00;42
225;A-05-01-02-006-002-02-4;SERVICIOS DE VENTA AL POR MENOR DE ELECTRODOMESTICOS, ARTICULOS Y EQUIPO DOMESTICOS EN ESTABLECIMIENTOS ESPECIALIZADOS;0000-00-00 00:00:00;0000-00-00 00:00:00;42
226;A-05-01-02-006-002-02-5;SERVICIOS DE VENTA AL POR MENOR DE PRODUCTOS DIVERSOS DE CONSUMO EN ESTABLECIMIENTOS ESPECIALIZADOS;0000-00-00 00:00:00;0000-00-00 00:00:00;42
227;A-05-01-02-006-002-02-6;SERVICIOS DE VENTA AL POR MENOR DE MATERIALES DE CONSTRUCCION Y FERRETERIA EN ESTABLECIMIENTOS ESPECIALIZADOS;0000-00-00 00:00:00;0000-00-00 00:00:00;42
228;A-05-01-02-006-002-02-7;SERVICIOS DE VENTA AL POR MENOR DE PRODUCTOS QUIMICOS Y FARMACEUTICOS EN ESTABLECIMIENTOS ESPECIALIZADOS;0000-00-00 00:00:00;0000-00-00 00:00:00;42
229;A-05-01-02-006-002-02-8;SERVICIOS DE VENTA AL POR MENOR DE MAQUINARIA, EQUIPO Y SUMINISTROS EN ESTABLECIMIENTOS ESPECIALIZADOS;0000-00-00 00:00:00;0000-00-00 00:00:00;42
230;A-05-01-02-006-002-02-9;SERVICIOS DE VENTA AL POR MENOR DE OTROS PRODUCTOS N.C.P. EN ESTABLECIMIENTOS ESPECIALIZADOS;0000-00-00 00:00:00;0000-00-00 00:00:00;42
231;A-05-01-02-006-002-03;SERVICIOS DE VENTA AL POR MENOR POR CORREO O INTERNET;0000-00-00 00:00:00;0000-00-00 00:00:00;42
232;A-05-01-02-006-002-03-1;SERVICIOS DE VENTA AL POR MENOR DE PRODUCTOS AGROPECUARIOS, UTILIZADOS PRINCIPALMENTE COMO MATERIAS PRIMAS, Y DE ANIMALES VIVOS POR CORREO O INTERNET;0000-00-00 00:00:00;0000-00-00 00:00:00;42
233;A-05-01-02-006-002-03-2;SERVICIOS DE VENTA AL POR MENOR DE ALIMENTOS, BEBIDAS Y TABACO POR INTERNET;0000-00-00 00:00:00;0000-00-00 00:00:00;42
234;A-05-01-02-006-002-03-3;SERVICIOS DE VENTA AL POR MENOR DE ARTICULOS TEXTILES, PRENDAS DE VESTIR Y CALZADO POR CORREO O INTERNET;0000-00-00 00:00:00;0000-00-00 00:00:00;42
235;A-05-01-02-006-002-03-4;SERVICIOS DE VENTA AL POR MENOR DE ELECTRODOMESTICOS, ARTICULOS Y EQUIPOS DOMESTICOS POR CORREO O INTERNET;0000-00-00 00:00:00;0000-00-00 00:00:00;42
236;A-05-01-02-006-002-03-5;SERVICIOS DE VENTA AL POR MENOR DE PRODUCTOS DIVERSOS DE CONSUMO POR CORREO O INTERNET;0000-00-00 00:00:00;0000-00-00 00:00:00;42
237;A-05-01-02-006-002-03-6;SERVICIOS DE VENTA AL POR MENOR DE MATERIALES DE CONSTRUCCION Y FERRETERIA POR CORREO O INTERNET;0000-00-00 00:00:00;0000-00-00 00:00:00;42
238;A-05-01-02-006-002-03-7;SERVICIOS DE VENTA AL POR MENOR DE PRODUCTOS QUIMICOS Y FARMACEUTICOS POR CORREO O INTERNET;0000-00-00 00:00:00;0000-00-00 00:00:00;42
239;A-05-01-02-006-002-03-8;SERVICIOS DE VENTA AL POR MENOR DE MAQUINARIA, EQUIPO Y SUMINISTROS POR CORREO O INTERNET;0000-00-00 00:00:00;0000-00-00 00:00:00;42
240;A-05-01-02-006-002-03-9;SERVICIOS DE VENTA AL POR MENOR DE OTROS PRODUCTOS POR CORREO O INTERNET;0000-00-00 00:00:00;0000-00-00 00:00:00;42
241;A-05-01-02-006-002-04;OTROS SERVICIOS DE VENTA AL POR MENOR NO REALIZADOS EN ESTABLECIMIENTOS;0000-00-00 00:00:00;0000-00-00 00:00:00;42
242;A-05-01-02-006-002-04-1;OTROS SERVICIOS DE VENTA AL POR MENOR DE PRODUCTOS AGROPECUARIOS, UTILIZADOS PRINCIPALMENTE COMO MATERIAS PRIMAS, Y DE ANIMALES VIVOS NO REALIZADOS EN ESTABLECIMIENTOS;0000-00-00 00:00:00;0000-00-00 00:00:00;42
243;A-05-01-02-006-002-04-2;OTROS SERVICIOS DE VENTA AL POR MENOR DE ALIMENTOS, BEBIDAS Y TABACO NO REALIZADOS EN ESTABLECIMIENTOS;0000-00-00 00:00:00;0000-00-00 00:00:00;42
244;A-05-01-02-006-002-04-3;OTROS SERVICIOS DE VENTA AL POR MENOR DE ARTICULOS TEXTILES, PRENDAS DE VESTIR Y CALZADO NO REALIZADOS EN ESTABLECIMIENTOS;0000-00-00 00:00:00;0000-00-00 00:00:00;42
245;A-05-01-02-006-002-04-4;OTROS SERVICIOS DE VENTA AL POR MENOR DE ELECTRODOMESTICOS, ARTICULOS Y EQUIPOS DOMESTICOS NO REALIZADOS EN ESTABLECIMIENTOS;0000-00-00 00:00:00;0000-00-00 00:00:00;42
246;A-05-01-02-006-002-04-5;OTROS SERVICIOS DE VENTA AL POR MENOR DE PRODUCTOS DIVERSOS DE CONSUMO NO REALIZADOS EN ESTABLECIMIENTOS;0000-00-00 00:00:00;0000-00-00 00:00:00;42
247;A-05-01-02-006-002-04-6;OTROS SERVICIOS DE VENTA AL POR MENOR DE MATERIALES DE CONSTRUCCION Y FERRETERIA NO REALIZADOS EN ESTABLECIMIENTOS;0000-00-00 00:00:00;0000-00-00 00:00:00;42
248;A-05-01-02-006-002-04-7;OTROS SERVICIOS DE VENTA AL POR MENOR DE PRODUCTOS QUIMICOS Y FARMACEUTICOS NO REALIZADOS EN ESTABLECIMIENTOS;0000-00-00 00:00:00;0000-00-00 00:00:00;42
249;A-05-01-02-006-002-04-8;OTROS SERVICIOS DE VENTA AL POR MENOR DE MAQUINARIA, EQUIPO Y SUMINISTROS NO REALIZADOS EN ESTABLECIMIENTOS;0000-00-00 00:00:00;0000-00-00 00:00:00;42
250;A-05-01-02-006-002-04-9;OTROS SERVICIOS DE VENTA AL POR MENOR DE OTROS PRODUCTOS NO REALIZADOS EN ESTABLECIMIENTOS;0000-00-00 00:00:00;0000-00-00 00:00:00;42
251;A-05-01-02-006-002-05;SERVICIOS DE VENTA AL POR MENOR PRESTADOS A COMISION O POR CONTRATA;0000-00-00 00:00:00;0000-00-00 00:00:00;42
252;A-05-01-02-006-002-05-1;SERVICIOS DE VENTA AL POR MENOR DE PRODUCTOS AGROPECUARIOS, UTILIZADOS PRINCIPALMENTE COMO MATERIAS PRIMAS, Y DE ANIMALES VIVOS, PRESTADOS A COMISION O POR CONTRATA;0000-00-00 00:00:00;0000-00-00 00:00:00;42
253;A-05-01-02-006-002-05-2;SERVICIOS DE VENTA AL POR MENOR DE ALIMENTOS, BEBIDAS Y TABACO, PRESTADOS A COMISION O POR CONTRATA;0000-00-00 00:00:00;0000-00-00 00:00:00;42
254;A-05-01-02-006-002-05-3;SERVICIOS DE VENTA AL POR MENOR DE ARTICULOS TEXTILES, PRENDAS DE VESTIR Y CALZADO, PRESTADOS A COMISION O POR CONTRATA;0000-00-00 00:00:00;0000-00-00 00:00:00;42
255;A-05-01-02-006-002-05-4;SERVICIOS DE VENTA AL POR MENOR DE ELECTRODOMESTICOS, ARTICULOS Y EQUIPO DOMESTICOS, PRESTADOS A COMISION O POR CONTRATA;0000-00-00 00:00:00;0000-00-00 00:00:00;42
256;A-05-01-02-006-002-05-5;SERVICIOS DE VENTA AL POR MENOR DE PRODUCTOS DIVERSOS DE CONSUMO, PRESTADOS A COMISION O POR CONTRATA;0000-00-00 00:00:00;0000-00-00 00:00:00;42
257;A-05-01-02-006-002-05-6;SERVICIOS DE VENTA AL POR MENOR DE MATERIALES DE CONSTRUCCION Y FERRETERIA, PRESTADOS A COMISION O POR CONTRATA;0000-00-00 00:00:00;0000-00-00 00:00:00;42
258;A-05-01-02-006-002-05-7;SERVICIOS DE VENTA AL POR MENOR DE PRODUCTOS QUIMICOS Y FARMACEUTICOS, PRESTADOS A COMISION O POR CONTRATA;0000-00-00 00:00:00;0000-00-00 00:00:00;42
259;A-05-01-02-006-002-05-8;SERVICIOS DE VENTA AL POR MENOR DE MAQUINARIA, EQUIPO Y SUMINISTROS, PRESTADOS A COMISION O POR CONTRATA;0000-00-00 00:00:00;0000-00-00 00:00:00;42
260;A-05-01-02-006-002-05-9;SERVICIOS DE VENTA AL POR MENOR DE OTROS PRODUCTOS, PRESTADOS A COMISION O POR CONTRATA;0000-00-00 00:00:00;0000-00-00 00:00:00;42
261;A-05-01-02-006-003-01;SERVICIOS DE ALOJAMIENTO PARA ESTANCIAS CORTAS;0000-00-00 00:00:00;0000-00-00 00:00:00;43
262;A-05-01-02-006-003-02;OTROS SERVICIOS DE ALOJAMIENTO;0000-00-00 00:00:00;0000-00-00 00:00:00;43
263;A-05-01-02-006-003-03;SERVICIOS DE SUMINISTRO DE COMIDAS;0000-00-00 00:00:00;0000-00-00 00:00:00;43
264;A-05-01-02-006-003-04;SERVICIOS DE SUMINISTRO DE BEBIDAS PARA SU CONSUMO DENTRO DEL ESTABLECIMIENTO;0000-00-00 00:00:00;0000-00-00 00:00:00;43
265;A-05-01-02-006-004;SERVICIOS DE TRANSPORTE DE PASAJEROS;0000-00-00 00:00:00;0000-00-00 00:00:00;44
266;A-05-01-02-006-005-01;SERVICIOS DE TRANSPORTE DE CARGA POR VIA TERRESTRE;0000-00-00 00:00:00;0000-00-00 00:00:00;45
267;A-05-01-02-006-005-02;SERVICIOS DE TRANSPORTE DE CARGA POR VIA ACUATICA;0000-00-00 00:00:00;0000-00-00 00:00:00;45
268;A-05-01-02-006-005-03;SERVICIOS DE TRANSPORTE DE CARGA POR VIA AEREA O ESPACIAL;0000-00-00 00:00:00;0000-00-00 00:00:00;45
269;A-05-01-02-006-006;SERVICIOS DE ALQUILER DE VEHICULOS DE TRANSPORTE CON OPERARIO;0000-00-00 00:00:00;0000-00-00 00:00:00;46
270;A-05-01-02-006-007-01;SERVICIOS DE MANIPULACION DE CARGA;0000-00-00 00:00:00;0000-00-00 00:00:00;47
271;A-05-01-02-006-007-02;SERVICIOS DE ALMACENAMIENTO Y DEPOSITO;0000-00-00 00:00:00;0000-00-00 00:00:00;47
272;A-05-01-02-006-007-03;SERVICIOS DE APOYO AL TRANSPORTE POR VIA FERREA;0000-00-00 00:00:00;0000-00-00 00:00:00;47
273;A-05-01-02-006-007-04;SERVICIOS DE APOYO AL TRANSPORTE POR CARRETERA;0000-00-00 00:00:00;0000-00-00 00:00:00;47
274;A-05-01-02-006-007-05;SERVICIOS DE APOYO AL TRANSPORTE POR VIA ACUATICA;0000-00-00 00:00:00;0000-00-00 00:00:00;47
275;A-05-01-02-006-007-06;SERVICIOS DE APOYO AL TRANSPORTE AEREO;0000-00-00 00:00:00;0000-00-00 00:00:00;47
276;A-05-01-02-006-007-09;OTROS SERVICIOS DE APOYO AL TRANSPORTE;0000-00-00 00:00:00;0000-00-00 00:00:00;47
277;A-05-01-02-006-008;SERVICIOS POSTALES Y DE MENSAJERIA;0000-00-00 00:00:00;0000-00-00 00:00:00;48
278;A-05-01-02-006-009-01;SERVICIOS DE DISTRIBUCION DE ELECTRICIDAD, Y SERVICIOS DE DISTRIBUCION DE GAS (POR CUENTA PROPIA);0000-00-00 00:00:00;0000-00-00 00:00:00;49
279;A-05-01-02-006-009-02;SERVICIOS DE DISTRIBUCION DE AGUA (POR CUENTA PROPIA);0000-00-00 00:00:00;0000-00-00 00:00:00;49
280;A-05-01-02-007-001-01;SERVICIOS FINANCIEROS, EXCEPTO DE LA BANCA DE INVERSION, SERVICIOS DE SEGUROS Y SERVICIOS DE PENSIONES;0000-00-00 00:00:00;0000-00-00 00:00:00;50
281;A-05-01-02-007-001-01-1;SERVICIOS FINANCIEROS, EXCEPTO DE LA BANCA DE INVERSION, SERVICIOS DE SEGUROS Y SERVICIOS DE PENSIONES;0000-00-00 00:00:00;0000-00-00 00:00:00;50
282;A-05-01-02-007-001-01-2;SERVICIOS DE DEPOSITO;0000-00-00 00:00:00;0000-00-00 00:00:00;50
283;A-05-01-02-007-001-01-3;SERVICIOS DE CONCESION DE CREDITO;0000-00-00 00:00:00;0000-00-00 00:00:00;50
284;A-05-01-02-007-001-01-4;SERVICIOS DE LEASING (ARRENDAMIENTO FINANCIERO);0000-00-00 00:00:00;0000-00-00 00:00:00;50
285;A-05-01-02-007-001-01-9;OTROS SERVICIOS FINANCIEROS, EXCEPTO LOS SERVICIOS DE LA BANCA DE INVERSION, SERVICIOS DE SEGUROS Y PENSIONES;0000-00-00 00:00:00;0000-00-00 00:00:00;50
286;A-05-01-02-007-001-02;SERVICIOS DE LA BANCA DE INVERSION;0000-00-00 00:00:00;0000-00-00 00:00:00;50
287;A-05-01-02-007-001-03;SERVICIOS DE SEGUROS Y PENSIONES (CON EXCLUSION DE SERVICIOS DE REASEGURO), EXCEPTO LOS SERVICIOS DE SEGUROS SOCIALES;0000-00-00 00:00:00;0000-00-00 00:00:00;50
288;A-05-01-02-007-001-03-1;SERVICIOS DE SEGUROS VIDA (CON EXCLUSION DE LOS SERVICIOS DE REASEGURO);0000-00-00 00:00:00;0000-00-00 00:00:00;50
289;A-05-01-02-007-001-03-2;SERVICIOS DE SEGUROS SOCIALES DE PENSIONES;0000-00-00 00:00:00;0000-00-00 00:00:00;50
290;A-05-01-02-007-001-03-3;SERVICIOS DE SEGUROS SOCIALES DE SALUD Y RIESGOS LABORALES;0000-00-00 00:00:00;0000-00-00 00:00:00;50
291;A-05-01-02-007-001-03-4;SERVICIOS DE SEGUROS DE SALUD Y DE ACCIDENTES;0000-00-00 00:00:00;0000-00-00 00:00:00;50
292;A-05-01-02-007-001-03-5;OTROS SERVICIOS DE SEGUROS DISTINTOS A LOS SEGUROS DE VIDA (EXCEPTO LOS SERVICIOS DE REASEGURO);0000-00-00 00:00:00;0000-00-00 00:00:00;50
293;A-05-01-02-007-001-03-5-01;SERVICIOS DE SEGUROS DE VEHICULOS AUTOMOTORES;0000-00-00 00:00:00;0000-00-00 00:00:00;50
294;A-05-01-02-007-001-03-5-02;SERVICIOS DE SEGUROS DE TRANSPORTE MARITIMO, DE AVIACION Y OTROS MEDIOS DE TRANSPORTE;0000-00-00 00:00:00;0000-00-00 00:00:00;50
295;A-05-01-02-007-001-03-5-03;SERVICIOS DE SEGUROS PARA TRANSPORTE DE MERCANCIAS (FLETES);0000-00-00 00:00:00;0000-00-00 00:00:00;50
296;A-05-01-02-007-001-03-5-04;SERVICIOS DE SEGUROS CONTRA INCENDIO, TERREMOTO O SUSTRACCION;0000-00-00 00:00:00;0000-00-00 00:00:00;50
297;A-05-01-02-007-001-03-5-05;SERVICIOS DE SEGUROS GENERALES DE RESPONSABILIDAD CIVIL;0000-00-00 00:00:00;0000-00-00 00:00:00;50
298;A-05-01-02-007-001-03-5-06;SERVICIOS DE SEGURO DE CUMPLIMIENTO;0000-00-00 00:00:00;0000-00-00 00:00:00;50
299;A-05-01-02-007-001-03-5-07;SERVICIOS DE SEGURO OBLIGATORIO DE ACCIDENTES DE TRANSITO (SOAT);0000-00-00 00:00:00;0000-00-00 00:00:00;50
300;A-05-01-02-007-001-03-5-08;SERVICIOS DE SEGUROS DE VIAJE;0000-00-00 00:00:00;0000-00-00 00:00:00;50
301;A-05-01-02-007-001-03-5-09;OTROS SERVICIOS DE SEGUROS DISTINTOS DE LOS SEGUROS DE VIDA N.C.P.;0000-00-00 00:00:00;0000-00-00 00:00:00;50
302;A-05-01-02-007-001-03-6;SERVICIOS DE LAS SOCIEDADES DE CAPITALIZACION;0000-00-00 00:00:00;0000-00-00 00:00:00;50
303;A-05-01-02-007-001-04;SERVICIOS DE REASEGURO;0000-00-00 00:00:00;0000-00-00 00:00:00;50
304;A-05-01-02-007-001-05;SERVICIOS AUXILIARES A LOS SERVICIOS FINANCIEROS DISTINTOS DE LOS SEGUROS Y LAS PENSIONES;0000-00-00 00:00:00;0000-00-00 00:00:00;50
305;A-05-01-02-007-001-05-1;SERVICIOS RELACIONADOS CON LA BANCA DE INVERSION;0000-00-00 00:00:00;0000-00-00 00:00:00;50
306;A-05-01-02-007-001-05-2;SERVICIOS DE CORRETAJE RELACIONADOS CON LOS PRODUCTOS DE VALORES;0000-00-00 00:00:00;0000-00-00 00:00:00;50
307;A-05-01-02-007-001-05-3;SERVICIOS DE ADMINISTRACION DE CARTERAS, EXCEPTO LOS FONDOS DE PENSIONES Y CESANTIAS;0000-00-00 00:00:00;0000-00-00 00:00:00;50
308;A-05-01-02-007-001-05-4;SERVICIOS FIDUCIARIOS Y DE CUSTODIA;0000-00-00 00:00:00;0000-00-00 00:00:00;50
309;A-05-01-02-007-001-05-5;SERVICIOS RELACIONADOS CON LA ADMINISTRACION DE LOS MERCADOS FINANCIEROS;0000-00-00 00:00:00;0000-00-00 00:00:00;50
310;A-05-01-02-007-001-05-9;OTROS SERVICIOS AUXILIARES A LOS SERVICIOS FINANCIEROS;0000-00-00 00:00:00;0000-00-00 00:00:00;50
311;A-05-01-02-007-001-06;SERVICIOS AUXILIARES DE SEGUROS, PENSIONES Y CESANTIAS;0000-00-00 00:00:00;0000-00-00 00:00:00;50
312;A-05-01-02-007-001-06-1;SERVICIOS DE CORRETAJE Y AGENCIAS DE SEGUROS;0000-00-00 00:00:00;0000-00-00 00:00:00;50
313;A-05-01-02-007-001-06-2;SERVICIOS DE TASACION DE LAS RECLAMACIONES AL SEGURO;0000-00-00 00:00:00;0000-00-00 00:00:00;50
314;A-05-01-02-007-001-06-3;SERVICIOS ACTUARIALES;0000-00-00 00:00:00;0000-00-00 00:00:00;50
315;A-05-01-02-007-001-06-4;SERVICIOS DE ADMINISTRACION DE FONDOS DE PENSIONES Y CESANTIAS;0000-00-00 00:00:00;0000-00-00 00:00:00;50
316;A-05-01-02-007-001-06-9;OTROS SERVICIOS AUXILIARES DE SEGUROS, PENSIONES Y CESANTIAS;0000-00-00 00:00:00;0000-00-00 00:00:00;50
317;A-05-01-02-007-001-07;SERVICIOS DE MANTENIMIENTO DE ACTIVOS FINANCIEROS;0000-00-00 00:00:00;0000-00-00 00:00:00;50
318;A-05-01-02-007-002-01;SERVICIOS INMOBILIARIOS RELATIVOS A BIENES RAICES PROPIOS O ARRENDADOS;0000-00-00 00:00:00;0000-00-00 00:00:00;51
319;A-05-01-02-007-002-01-1;SERVICIOS DE ALQUILER O ARRENDAMIENTO CON O SIN OPCION DE COMPRA RELATIVOS A BIENES INMUEBLES PROPIOS O ARRENDADOS;0000-00-00 00:00:00;0000-00-00 00:00:00;51
320;A-05-01-02-007-002-01-2;VENTA DE BIENES INMUEBLES;0000-00-00 00:00:00;0000-00-00 00:00:00;51
321;A-05-01-02-007-002-01-3;SERVICIOS COMERCIALES RELACIONADOS CON TERRENOS DESOCUPADOS Y SUBDIVIDIDOS;0000-00-00 00:00:00;0000-00-00 00:00:00;51
322;A-05-01-02-007-002-02;SERVICIOS INMOBILIARIOS A COMISION O POR CONTRATO;0000-00-00 00:00:00;0000-00-00 00:00:00;51
323;A-05-01-02-007-002-02-1;SERVICIOS DE ADMINISTRACION DE BIENES INMUEBLES A COMISION O POR CONTRATO;0000-00-00 00:00:00;0000-00-00 00:00:00;51
324;A-05-01-02-007-002-02-2;SERVICIO DE ARRENDAMIENTO DE BIENES INMUEBLES A COMISION O POR CONTRATA;0000-00-00 00:00:00;0000-00-00 00:00:00;51
325;A-05-01-02-007-002-02-3;SERVICIO DE VENTA DE BIENES INMUEBLES A COMISION O POR CONTRATA;0000-00-00 00:00:00;0000-00-00 00:00:00;51
326;A-05-01-02-007-002-02-4;SERVICIOS DE VENTA DE TERRENOS A COMISION O POR CONTRATO;0000-00-00 00:00:00;0000-00-00 00:00:00;51
327;A-05-01-02-007-002-02-5;VALUACIONES INMOBILIARIAS A COMISION O POR CONTRATO;0000-00-00 00:00:00;0000-00-00 00:00:00;51
328;A-05-01-02-007-003-01;SERVICIOS DE ARRENDAMIENTO O ALQUILER DE MAQUINARIA Y EQUIPO SIN OPERARIO;0000-00-00 00:00:00;0000-00-00 00:00:00;52
329;A-05-01-02-007-003-02;SERVICIOS DE ARRENDAMIENTO SIN OPCION DE COMPRA DE OTROS BIENES;0000-00-00 00:00:00;0000-00-00 00:00:00;52
330;A-05-01-02-007-003-03;DERECHOS DE USO DE PRODUCTOS DE PROPIEDAD INTELECTUAL Y OTROS PRODUCTOS SIMILARES;0000-00-00 00:00:00;0000-00-00 00:00:00;52
331;A-05-01-02-007-003-03-1;DERECHOS DE USO DE PROGRAMAS INFORMATICOS Y BASES DE DATOS;0000-00-00 00:00:00;0000-00-00 00:00:00;52
332;A-05-01-02-007-003-03-2;DERECHOS DE USO DE OBRAS ORIGINALES LITERARIAS, ARTISTICAS Y DE ENTRETENIMIENTO;0000-00-00 00:00:00;0000-00-00 00:00:00;52
333;A-05-01-02-007-003-03-3;DERECHOS DE USO DE PRODUCTOS DE INVESTIGACION Y DESARROLLO;0000-00-00 00:00:00;0000-00-00 00:00:00;52
334;A-05-01-02-007-003-03-4;DERECHOS DE USO DE MARCAS Y FRANQUICIAS;0000-00-00 00:00:00;0000-00-00 00:00:00;52
335;A-05-01-02-007-003-03-5;DERECHOS DE USO DE EVALUACION Y EXPLORACION MINERA;0000-00-00 00:00:00;0000-00-00 00:00:00;52
336;A-05-01-02-007-003-03-9;DERECHOS DE USO DE OTROS PRODUCTOS DE PROPIEDAD INTELECTUAL;0000-00-00 00:00:00;0000-00-00 00:00:00;52
337;A-05-01-02-008-001-01;SERVICIOS DE INVESTIGACION Y DESARROLLO EXPERIMENTAL EN CIENCIAS NATURALES E INGENIERIA;0000-00-00 00:00:00;0000-00-00 00:00:00;53
338;A-05-01-02-008-001-02;SERVICIOS DE INVESTIGACION Y DESARROLLO EXPERIMENTAL EN CIENCIAS SOCIALES Y HUMANIDADES;0000-00-00 00:00:00;0000-00-00 00:00:00;53
339;A-05-01-02-008-001-03;SERVICIOS INTERDISCIPLINARIOS DE INVESTIGACION Y DESARROLLO EXPERIMENTAL;0000-00-00 00:00:00;0000-00-00 00:00:00;53
340;A-05-01-02-008-001-04;CREACIONES ORIGINALES RELACIONADAS CON LA INVESTIGACION Y DESARROLLO;0000-00-00 00:00:00;0000-00-00 00:00:00;53
341;A-05-01-02-008-002-01;SERVICIOS JURIDICOS;0000-00-00 00:00:00;0000-00-00 00:00:00;54
342;A-05-01-02-008-002-02;SERVICIOS DE CONTABILIDAD, AUDITORIA Y TENEDURIA DE LIBROS;0000-00-00 00:00:00;0000-00-00 00:00:00;54
343;A-05-01-02-008-002-03;SERVICIOS DE PREPARACION Y ASESORAMIENTO TRIBUTARIO;0000-00-00 00:00:00;0000-00-00 00:00:00;54
344;A-05-01-02-008-002-04;SERVICIOS RELACIONADOS CON CASOS DE INSOLVENCIA Y LIQUIDACION;0000-00-00 00:00:00;0000-00-00 00:00:00;54
345;A-05-01-02-008-003-01;SERVICIOS DE CONSULTORIA EN ADMINISTRACION Y SERVICIOS DE GESTION SERVICIOS DE TECNOLOGIA DE LA INFORMACION;0000-00-00 00:00:00;0000-00-00 00:00:00;55
346;A-05-01-02-008-003-01-1;SERVICIOS DE CONSULTORIA EN ADMINISTRACION Y SERVICIOS DE GESTION;0000-00-00 00:00:00;0000-00-00 00:00:00;55
347;A-05-01-02-008-003-01-2;SERVICIOS DE CONSULTORIA PRESTADOS A LAS EMPRESAS;0000-00-00 00:00:00;0000-00-00 00:00:00;55
348;A-05-01-02-008-003-01-3;SERVICIOS DE TECNOLOGIA DE LA INFORMACION (TI) DE CONSULTORIA Y DE APOYO;0000-00-00 00:00:00;0000-00-00 00:00:00;55
349;A-05-01-02-008-003-01-4;SERVICIOS DE DISE¥O Y DESARROLLO DE LA TECNOLOGIA DE LA INFORMACION (TI);0000-00-00 00:00:00;0000-00-00 00:00:00;55
350;A-05-01-02-008-003-01-5;SERVICIOS DE SUMINISTRO DE INFRAESTRUCTURA DE HOSTING Y DE TECNOLOGIA DE LA INFORMACION (TI);0000-00-00 00:00:00;0000-00-00 00:00:00;55
351;A-05-01-02-008-003-01-6;SERVICIOS DE GESTION DE RED E INFRAESTRUCTURA DE TI;0000-00-00 00:00:00;0000-00-00 00:00:00;55
352;A-05-01-02-008-003-01-9;OTROS SERVICIOS DE GESTION, EXCEPTO LOS SERVICIOS DE ADMINISTRACION DE PROYECTOS DE CONSTRUCCION;0000-00-00 00:00:00;0000-00-00 00:00:00;55
353;A-05-01-02-008-003-02;SERVICIOS DE ARQUITECTURA, SERVICIOS DE PLANEACION URBANA Y ORDENACION DEL TERRITORIO SERVICIOS DE ARQUITECTURA PAISAJISTA;0000-00-00 00:00:00;0000-00-00 00:00:00;55
354;A-05-01-02-008-003-03;SERVICIOS DE INGENIERIA;0000-00-00 00:00:00;0000-00-00 00:00:00;55
355;A-05-01-02-008-003-04;SERVICIOS CIENTIFICOS Y OTROS SERVICIOS TECNICOS;0000-00-00 00:00:00;0000-00-00 00:00:00;55
356;A-05-01-02-008-003-04-1;SERVICIOS DE PROSPECCION GEOLOGICA, GEOFISICA Y OTROS;0000-00-00 00:00:00;0000-00-00 00:00:00;55
357;A-05-01-02-008-003-04-2;SERVICIOS DE TOPOGRAFIA DE SUPERFICIE Y CARTOGRAFIA;0000-00-00 00:00:00;0000-00-00 00:00:00;55
358;A-05-01-02-008-003-04-3;PRONOSTICO DEL TIEMPO Y SERVICIOS METEOROLOGICOS;0000-00-00 00:00:00;0000-00-00 00:00:00;55
359;A-05-01-02-008-003-04-4;SERVICIOS DE ENSAYO Y ANALISIS TECNICOS;0000-00-00 00:00:00;0000-00-00 00:00:00;55
360;A-05-01-02-008-003-05;SERVICIOS VETERINARIOS;0000-00-00 00:00:00;0000-00-00 00:00:00;55
361;A-05-01-02-008-003-06;SERVICIOS DE PUBLICIDAD Y EL SUMINISTRO DE ESPACIO O TIEMPO PUBLICITARIOS;0000-00-00 00:00:00;0000-00-00 00:00:00;55
362;A-05-01-02-008-003-07;SERVICIOS DE INVESTIGACION DE MERCADOS Y DE ENCUESTAS DE OPINION PUBLICA;0000-00-00 00:00:00;0000-00-00 00:00:00;55
363;A-05-01-02-008-003-08;SERVICIOS FOTOGRAFICOS Y SERVICIOS DE REVELADO FOTOGRAFICO;0000-00-00 00:00:00;0000-00-00 00:00:00;55
364;A-05-01-02-008-003-09;OTROS SERVICIOS PROFESIONALES Y TECNICOS N.C.P.;0000-00-00 00:00:00;0000-00-00 00:00:00;55
365;A-05-01-02-008-004-01;SERVICIOS DE TELEFONIA Y OTRAS TELECOMUNICACIONES;0000-00-00 00:00:00;0000-00-00 00:00:00;56
366;A-05-01-02-008-004-02;SERVICIOS DE TELECOMUNICACIONES A TRAVES DE INTERNET;0000-00-00 00:00:00;0000-00-00 00:00:00;56
367;A-05-01-02-008-004-03;SERVICIOS DE CONTENIDOS EN LINEA (ON-LINE);0000-00-00 00:00:00;0000-00-00 00:00:00;56
368;A-05-01-02-008-004-04;SERVICIOS DE AGENCIAS DE NOTICIAS;0000-00-00 00:00:00;0000-00-00 00:00:00;56
369;A-05-01-02-008-004-05;SERVICIOS DE BIBLIOTECAS Y ARCHIVOS;0000-00-00 00:00:00;0000-00-00 00:00:00;56
370;A-05-01-02-008-004-06;SERVICIOS DE PROGRAMACION, DISTRIBUCION Y TRANSMISION DE PROGRAMAS;0000-00-00 00:00:00;0000-00-00 00:00:00;56
371;A-05-01-02-008-005-01;SERVICIOS DE EMPLEO;0000-00-00 00:00:00;0000-00-00 00:00:00;57
372;A-05-01-02-008-005-02;SERVICIOS DE INVESTIGACION Y SEGURIDAD;0000-00-00 00:00:00;0000-00-00 00:00:00;57
373;A-05-01-02-008-005-03;SERVICIOS DE LIMPIEZA;0000-00-00 00:00:00;0000-00-00 00:00:00;57
374;A-05-01-02-008-005-04;SERVICIOS DE EMPAQUE;0000-00-00 00:00:00;0000-00-00 00:00:00;57
375;A-05-01-02-008-005-05;SERVICIOS DE ORGANIZACION DE VIAJES, OPERADORES TURISTICOS Y SERVICIOS CONEXOS;0000-00-00 00:00:00;0000-00-00 00:00:00;57
376;A-05-01-02-008-005-09;OTROS SERVICIOS AUXILIARES;0000-00-00 00:00:00;0000-00-00 00:00:00;57
377;A-05-01-02-008-005-09-1;SERVICIOS DE INFORMACION CREDITICIA;0000-00-00 00:00:00;0000-00-00 00:00:00;57
378;A-05-01-02-008-005-09-2;SERVICIOS DE AGENCIAS DE COBRANZA;0000-00-00 00:00:00;0000-00-00 00:00:00;57
379;A-05-01-02-008-005-09-3;SERVICIOS AUXILIARES POR TELEFONO;0000-00-00 00:00:00;0000-00-00 00:00:00;57
380;A-05-01-02-008-005-09-4;SERVICIOS ADMINISTRATIVOS COMBINADOS DE OFICINA;0000-00-00 00:00:00;0000-00-00 00:00:00;57
381;A-05-01-02-008-005-09-5;SERVICIOS AUXILIARES ESPECIALIZADOS DE OFICINA;0000-00-00 00:00:00;0000-00-00 00:00:00;57
