382;A-05-01-02-008-005-09-6;SERVICIOS DE ORGANIZACION Y ASISTENCIA DE CONVENCIONES Y FERIAS;0000-00-00 00:00:00;0000-00-00 00:00:00;57
383;A-05-01-02-008-005-09-7;SERVICIOS DE MANTENIMIENTO Y CUIDADO DEL PAISAJE;0000-00-00 00:00:00;0000-00-00 00:00:00;57
384;A-05-01-02-008-005-09-9;OTROS SERVICIOS DE APOYO Y DE INFORMACION N.C.P.;0000-00-00 00:00:00;0000-00-00 00:00:00;57
385;A-05-01-02-008-006-01;SERVICIOS DE APOYO A LA AGRICULTURA, LA CAZA, LA SILVICULTURA Y LA PESCA;0000-00-00 00:00:00;0000-00-00 00:00:00;58
386;A-05-01-02-008-006-02;SERVICIOS DE APOYO A LA MINERIA;0000-00-00 00:00:00;0000-00-00 00:00:00;58
387;A-05-01-02-008-006-03;SERVICIOS DE APOYO A LA DISTRIBUCION DE ELECTRICIDAD, GAS Y AGUA;0000-00-00 00:00:00;0000-00-00 00:00:00;58
388;A-05-01-02-008-007-01;SERVICIOS DE MANTENIMIENTO Y REPARACION DE PRODUCTOS METALICOS ELABORADOS, MAQUINARIA Y EQUIPO;0000-00-00 00:00:00;0000-00-00 00:00:00;59
389;A-05-01-02-008-007-01-1;SERVICIOS DE MANTENIMIENTO Y REPARACION DE PRODUCTOS METALICOS ELABORADOS, EXCEPTO MAQUINARIA Y EQUIPO;0000-00-00 00:00:00;0000-00-00 00:00:00;59
390;A-05-01-02-008-007-01-2;SERVICIOS DE MANTENIMIENTO Y REPARACION DE MAQUINARIA DE OFICINA Y CONTABILIDAD;0000-00-00 00:00:00;0000-00-00 00:00:00;59
391;A-05-01-02-008-007-01-3;SERVICIOS DE MANTENIMIENTO Y REPARACION DE COMPUTADORES Y EQUIPO PERIFERICO;0000-00-00 00:00:00;0000-00-00 00:00:00;59
392;A-05-01-02-008-007-01-4;SERVICIOS DE MANTENIMIENTO Y REPARACION DE MAQUINARIA Y EQUIPO DE TRANSPORTE;0000-00-00 00:00:00;0000-00-00 00:00:00;59
393;A-05-01-02-008-007-01-5;SERVICIOS DE MANTENIMIENTO Y REPARACION DE OTRA MAQUINARIA Y OTRO EQUIPO;0000-00-00 00:00:00;0000-00-00 00:00:00;59
394;A-05-01-02-008-007-02;SERVICIOS DE REPARACION DE OTROS BIENES;0000-00-00 00:00:00;0000-00-00 00:00:00;59
395;A-05-01-02-008-007-02-1;SERVICIOS DE REPARACION DE CALZADO Y ARTICULOS DE CUERO;0000-00-00 00:00:00;0000-00-00 00:00:00;59
396;A-05-01-02-008-007-02-2;SERVICIOS DE REPARACION DE RELOJES Y JOYAS;0000-00-00 00:00:00;0000-00-00 00:00:00;59
397;A-05-01-02-008-007-02-3;SERVICIOS DE REPARACION DE PRENDAS DE VESTIR Y TEXTILES PARA EL HOGAR;0000-00-00 00:00:00;0000-00-00 00:00:00;59
398;A-05-01-02-008-007-02-4;SERVICIOS DE REPARACION DE MUEBLES;0000-00-00 00:00:00;0000-00-00 00:00:00;59
399;A-05-01-02-008-007-02-9;SERVICIOS DE MANTENIMIENTO Y REPARACION DE OTROS BIENES N.C.P.;0000-00-00 00:00:00;0000-00-00 00:00:00;59
400;A-05-01-02-008-007-03;SERVICIOS DE INSTALACION (DISTINTOS DE LOS SERVICIOS DE CONSTRUCCION);0000-00-00 00:00:00;0000-00-00 00:00:00;59
401;A-05-01-02-008-007-03-1;SERVICIOS DE INSTALACION DE PRODUCTOS METALICOS ELABORADOS, EXCEPTO MAQUINARIA Y EQUIPO;0000-00-00 00:00:00;0000-00-00 00:00:00;59
402;A-05-01-02-008-007-03-2;SERVICIOS DE INSTALACION DE MAQUINARIA Y EQUIPO PARA EL SECTOR INDUSTRIAL;0000-00-00 00:00:00;0000-00-00 00:00:00;59
403;A-05-01-02-008-007-03-3;SERVICIOS DE INSTALACION DE MAQUINARIA DE OFICINA, CONTABILIDAD Y COMPUTADORES;0000-00-00 00:00:00;0000-00-00 00:00:00;59
404;A-05-01-02-008-007-03-4;SERVICIOS DE INSTALACION DE EQUIPOS Y APARATOS DE RADIO, TELEVISION Y COMUNICACIONES;0000-00-00 00:00:00;0000-00-00 00:00:00;59
405;A-05-01-02-008-007-03-5;SERVICIOS DE INSTALACION DE MAQUINARIA Y EQUIPO MEDICO PROFESIONAL, E INSTRUMENTOS DE PRECISION Y OPTICOS;0000-00-00 00:00:00;0000-00-00 00:00:00;59
406;A-05-01-02-008-007-03-6;SERVICIOS DE INSTALACION DE MAQUINARIA Y APARATOS ELECTRICOS N.C.P.;0000-00-00 00:00:00;0000-00-00 00:00:00;59
407;A-05-01-02-008-007-03-9;SERVICIOS DE INSTALACION DE OTROS BIENES N.C.P.;0000-00-00 00:00:00;0000-00-00 00:00:00;59
408;A-05-01-02-008-008-01;SERVICIOS DE FABRICACION DE ALIMENTOS, BEBIDAS Y TABACO;0000-00-00 00:00:00;0000-00-00 00:00:00;60
409;A-05-01-02-008-008-02;SERVICIOS DE FABRICACION DE TEXTILES, CONFECCIONES Y PRODUCTOS DE CUERO;0000-00-00 00:00:00;0000-00-00 00:00:00;60
410;A-05-01-02-008-008-03;SERVICIOS DE FABRICACION DE LA MADERA Y EL PAPEL;0000-00-00 00:00:00;0000-00-00 00:00:00;60
411;A-05-01-02-008-008-04;SERVICIOS DE FABRICACION DE PRODUCTOS DE LA REFINACION DEL PETROLEO, PRODUCTOS QUIMICOS Y FARMACEUTICOS;0000-00-00 00:00:00;0000-00-00 00:00:00;60
412;A-05-01-02-008-008-05;SERVICIOS DE FABRICACION DE PRODUCTOS DE CAUCHO, PLASTICO Y OTROS PRODUCTOS MINERALES NO METALICOS;0000-00-00 00:00:00;0000-00-00 00:00:00;60
413;A-05-01-02-008-008-06;SERVICIOS DE FABRICACION DE PRODUCTOS METALURGICOS BASICOS;0000-00-00 00:00:00;0000-00-00 00:00:00;60
414;A-05-01-02-008-008-07;SERVICIOS DE FABRICACION DE PRODUCTOS METALICOS ELABORADOS, MAQUINARIA Y EQUIPO;0000-00-00 00:00:00;0000-00-00 00:00:00;60
415;A-05-01-02-008-008-08;SERVICIOS DE FABRICACION DE EQUIPO DE TRANSPORTE;0000-00-00 00:00:00;0000-00-00 00:00:00;60
416;A-05-01-02-008-008-09;OTROS SERVICIOS DE FABRICACION;0000-00-00 00:00:00;0000-00-00 00:00:00;60
417;A-05-01-02-008-009-01;SERVICIOS DE EDICION, IMPRESION Y REPRODUCCION;0000-00-00 00:00:00;0000-00-00 00:00:00;61
418;A-05-01-02-008-009-02;SERVICIOS DE MOLDEADO, ESTAMPADO, EXTRUSION Y FABRICACION DE PRODUCTOS SIMILARES DE PLASTICO;0000-00-00 00:00:00;0000-00-00 00:00:00;61
419;A-05-01-02-008-009-03;SERVICIOS DE FUNDICION, FORJA, ESTAMPADO Y FABRICACION DE PRODUCTOS SIMILARES DE METALES;0000-00-00 00:00:00;0000-00-00 00:00:00;61
420;A-05-01-02-008-009-04;SERVICIOS DE RECUPERACION DE MATERIALES, A COMISION O POR CONTRATO;0000-00-00 00:00:00;0000-00-00 00:00:00;61
421;A-05-01-02-009-002-01;SERVICIOS DE EDUCACION DE LA PRIMERA INFANCIA Y PREESCOLAR;0000-00-00 00:00:00;0000-00-00 00:00:00;62
422;A-05-01-02-009-002-02;SERVICIOS DE ENSE¥ANZA PRIMARIA;0000-00-00 00:00:00;0000-00-00 00:00:00;62
423;A-05-01-02-009-002-03;SERVICIOS DE EDUCACION SECUNDARIA;0000-00-00 00:00:00;0000-00-00 00:00:00;62
424;A-05-01-02-009-002-04;SERVICIOS DE EDUCACION POSTSECUNDARIA NO TERCIARIA;0000-00-00 00:00:00;0000-00-00 00:00:00;62
425;A-05-01-02-009-002-05;SERVICIOS DE EDUCACION SUPERIOR (TERCIARIA);0000-00-00 00:00:00;0000-00-00 00:00:00;62
426;A-05-01-02-009-002-09;OTROS TIPOS DE EDUCACION Y SERVICIOS DE APOYO EDUCATIVO;0000-00-00 00:00:00;0000-00-00 00:00:00;62
427;A-05-01-02-009-003-01;SERVICIOS DE SALUD HUMANA;0000-00-00 00:00:00;0000-00-00 00:00:00;63
428;A-05-01-02-009-003-02;SERVICIOS DE ATENCION RESIDENCIAL PARA PERSONAS MAYORES Y CON DISCAPACIDAD;0000-00-00 00:00:00;0000-00-00 00:00:00;63
429;A-05-01-02-009-003-03;OTROS SERVICIOS SOCIALES CON ALOJAMIENTO;0000-00-00 00:00:00;0000-00-00 00:00:00;63
430;A-05-01-02-009-003-04;SERVICIOS SOCIALES SIN ALOJAMIENTO PARA PERSONAS MAYORES Y CON DISCAPACIDAD;0000-00-00 00:00:00;0000-00-00 00:00:00;63
431;A-05-01-02-009-003-05;OTROS SERVICIOS SOCIALES SIN ALOJAMIENTO;0000-00-00 00:00:00;0000-00-00 00:00:00;63
432;A-05-01-02-009-004-01;SERVICIOS DE ALCANTARILLADO, SERVICIOS DE LIMPIEZA, TRATAMIENTO DE AGUAS RESIDUALES Y TANQUES SEPTICOS;0000-00-00 00:00:00;0000-00-00 00:00:00;64
433;A-05-01-02-009-004-02;SERVICIOS DE RECOLECCION DE DESECHOS;0000-00-00 00:00:00;0000-00-00 00:00:00;64
434;A-05-01-02-009-004-03;SERVICIOS DE TRATAMIENTO Y DISPOSICION DE DESECHOS;0000-00-00 00:00:00;0000-00-00 00:00:00;64
435;A-05-01-02-009-004-04;SERVICIOS DE DESCONTAMINACION;0000-00-00 00:00:00;0000-00-00 00:00:00;64
436;A-05-01-02-009-004-05;SERVICIOS DE SANEAMIENTO Y SIMILARES;0000-00-00 00:00:00;0000-00-00 00:00:00;64
437;A-05-01-02-009-004-09;OTROS SERVICIOS DE PROTECCION DEL MEDIO AMBIENTE N.C.P.;0000-00-00 00:00:00;0000-00-00 00:00:00;64
438;A-05-01-02-009-006-01;SERVICIOS AUDIOVISUALES Y SERVICIOS CONEXOS;0000-00-00 00:00:00;0000-00-00 00:00:00;65
439;A-05-01-02-009-006-02;SERVICIOS DE PROMOCION Y PRESENTACION DE ARTES ESCENICAS Y EVENTOS DE ENTRETENIMIENTO EN VIVO;0000-00-00 00:00:00;0000-00-00 00:00:00;65
440;A-05-01-02-009-006-03;SERVICIOS RELACIONADOS CON ACTORES Y OTROS ARTISTAS;0000-00-00 00:00:00;0000-00-00 00:00:00;65
441;A-05-01-02-009-006-04;SERVICIOS DE PRESERVACION Y MUSEOS;0000-00-00 00:00:00;0000-00-00 00:00:00;65
442;A-05-01-02-009-006-05;SERVICIOS DEPORTIVOS Y DEPORTES RECREATIVOS;0000-00-00 00:00:00;0000-00-00 00:00:00;65
443;A-05-01-02-009-006-06;SERVICIOS DE ATLETAS Y SERVICIOS DE AUXILIARES CONEXOS;0000-00-00 00:00:00;0000-00-00 00:00:00;65
444;A-05-01-02-009-006-09;OTROS SERVICIOS DE ESPARCIMIENTO Y DIVERSION;0000-00-00 00:00:00;0000-00-00 00:00:00;65
445;A-05-01-02-009-007-01;SERVICIOS DE LAVADO, LIMPIEZA Y TE¥IDO;0000-00-00 00:00:00;0000-00-00 00:00:00;66
446;A-05-01-02-009-007-02;SERVICIOS DE TRATAMIENTOS DE BELLEZA Y DE BIENESTAR FISICO;0000-00-00 00:00:00;0000-00-00 00:00:00;66
447;A-05-01-02-009-007-03;SERVICIOS FUNERARIOS, DE CREMACION Y DE SEPULTURA;0000-00-00 00:00:00;0000-00-00 00:00:00;66
448;A-05-01-02-009-007-09;OTROS SERVICIOS DIVERSOS N.C.P.;0000-00-00 00:00:00;0000-00-00 00:00:00;66
449;A-05-01-02-009-009;SERVICIOS PRESTADOS POR ORGANIZACIONES Y ORGANISMOS EXTRATERRITORIALES;0000-00-00 00:00:00;0000-00-00 00:00:00;67
450;A-02-01-01-001-001;VIVIENDAS;0000-00-00 00:00:00;0000-00-00 00:00:00;68
451;A-02-01-01-001-001-01;EDIFICIOS UTILIZADOS PARA RESIDENCIA;0000-00-00 00:00:00;0000-00-00 00:00:00;68
452;A-02-01-01-001-001-02;CASAS FLOTANTES;0000-00-00 00:00:00;0000-00-00 00:00:00;68
453;A-02-01-01-001-001-03;BARCAZAS;0000-00-00 00:00:00;0000-00-00 00:00:00;68
454;A-02-01-01-001-001-04;VIVIENDAS MOVILES;0000-00-00 00:00:00;0000-00-00 00:00:00;68
455;A-02-01-01-001-001-05;COCHES HABITACION;0000-00-00 00:00:00;0000-00-00 00:00:00;68
456;A-02-01-01-001-001-06;MONUMENTOS PUBLICOS CONSIDERADOS PRINCIPALMENTE COMO VIVIENDAS;0000-00-00 00:00:00;0000-00-00 00:00:00;68
457;A-02-01-01-001-001-07;VIVIENDAS PARA PERSONAL MILITAR;0000-00-00 00:00:00;0000-00-00 00:00:00;68
458;A-02-01-01-001-001-08;CONSTRUCCIONES PREFABRICADAS;0000-00-00 00:00:00;0000-00-00 00:00:00;68
459;A-02-01-01-001-001-09;OTROS EDIFICIOS UTILIZADOS COMO RESIDENCIA;0000-00-00 00:00:00;0000-00-00 00:00:00;68
460;A-02-01-01-001-002;EDIFICIOS DISTINTOS A VIVIENDAS;0000-00-00 00:00:00;0000-00-00 00:00:00;69
461;A-02-01-01-001-002-01;MONUMENTOS PUBLICOS NO RESIDENCIALES;0000-00-00 00:00:00;0000-00-00 00:00:00;69
462;A-02-01-01-001-002-02;EDIFICIOS INDUSTRIALES;0000-00-00 00:00:00;0000-00-00 00:00:00;69
463;A-02-01-01-001-002-03;EDIFICIOS COMERCIALES;0000-00-00 00:00:00;0000-00-00 00:00:00;69
464;A-02-01-01-001-002-04;EDIFICIOS PUBLICOS DE ENTRETENIMIENTO;0000-00-00 00:00:00;0000-00-00 00:00:00;69
465;A-02-01-01-001-002-05;EDIFICIOS DE HOTELES;0000-00-00 00:00:00;0000-00-00 00:00:00;69
466;A-02-01-01-001-002-06;RESTAURANTES;0000-00-00 00:00:00;0000-00-00 00:00:00;69
467;A-02-01-01-001-002-07;EDIFICIOS EDUCATIVOS;0000-00-00 00:00:00;0000-00-00 00:00:00;69
468;A-02-01-01-001-002-08;EDIFICIOS RELACIONADOS CON LA SALUD;0000-00-00 00:00:00;0000-00-00 00:00:00;69
469;A-02-01-01-001-002-09;PRISIONES;0000-00-00 00:00:00;0000-00-00 00:00:00;69
470;A-02-01-01-001-002-10;EDIFICIOS Y ESTRUCTURAS PARA FINES MILITARES;0000-00-00 00:00:00;0000-00-00 00:00:00;69
471;A-02-01-01-001-002-11;OTROS EDIFICIOS NO RESIDENCIALES;0000-00-00 00:00:00;0000-00-00 00:00:00;69
472;A-02-01-01-001-003;OTRAS ESTRUCTURAS;0000-00-00 00:00:00;0000-00-00 00:00:00;70
473;A-02-01-01-001-003-01;AUTOPISTAS, CARRETERAS, CALLES;0000-00-00 00:00:00;0000-00-00 00:00:00;70
474;A-02-01-01-001-003-02;PISTAS DE ATERRIZAJE;0000-00-00 00:00:00;0000-00-00 00:00:00;70
475;A-02-01-01-001-003-03;FERROCARRILES;0000-00-00 00:00:00;0000-00-00 00:00:00;70
476;A-02-01-01-001-003-04;PUENTES;0000-00-00 00:00:00;0000-00-00 00:00:00;70
477;A-02-01-01-001-003-05;CARRETERAS ELEVADAS;0000-00-00 00:00:00;0000-00-00 00:00:00;70
478;A-02-01-01-001-003-06;TUNELES;0000-00-00 00:00:00;0000-00-00 00:00:00;70
479;A-02-01-01-001-003-07;ACUEDUCTOS Y OTROS CONDUCTOS DE SUMINISTRO DE AGUA, EXCEPTO GASODUCTOS;0000-00-00 00:00:00;0000-00-00 00:00:00;70
480;A-02-01-01-001-003-08;PUERTOS, VIAS NAVEGABLES E INSTALACIONES CONEXAS;0000-00-00 00:00:00;0000-00-00 00:00:00;70
481;A-02-01-01-001-003-09;REPRESAS;0000-00-00 00:00:00;0000-00-00 00:00:00;70
482;A-02-01-01-001-003-10;SISTEMAS DE RIEGO Y OBRAS HIDRAULICA;0000-00-00 00:00:00;0000-00-00 00:00:00;70
483;A-02-01-01-001-003-11;TUBERIAS DE LARGA DISTANCIA;0000-00-00 00:00:00;0000-00-00 00:00:00;70
484;A-02-01-01-001-003-12;OBRAS PARA LA COMUNICACION DE LARGA DISTANCIA Y LAS LINEAS ELECTRICAS (CABLES);0000-00-00 00:00:00;0000-00-00 00:00:00;70
485;A-02-01-01-001-003-13;GASODUCTOS Y OLEODUCTOS;0000-00-00 00:00:00;0000-00-00 00:00:00;70
486;A-02-01-01-001-003-14;CABLES LOCALES Y OBRAS CONEXAS;0000-00-00 00:00:00;0000-00-00 00:00:00;70
487;A-02-01-01-001-003-15;ALCANTARILLAS Y PLANTAS DE TRATAMIENTO DE AGUA;0000-00-00 00:00:00;0000-00-00 00:00:00;70
488;A-02-01-01-001-003-16;CONSTRUCCIONES EN MINAS Y PLANTAS INDUSTRIALES;0000-00-00 00:00:00;0000-00-00 00:00:00;70
489;A-02-01-01-001-003-17;CONSTRUCCIONES DEPORTIVAS AL AIRE LIBRE;0000-00-00 00:00:00;0000-00-00 00:00:00;70
490;A-02-01-01-001-003-18;OTRAS OBRAS DE INGENIERIA CIVIL;0000-00-00 00:00:00;0000-00-00 00:00:00;70
491;A-02-01-01-001-004;MEJORAS DE TIERRAS Y TERRENOS;0000-00-00 00:00:00;0000-00-00 00:00:00;71
492;A-02-01-01-002-001;BUQUES DE GUERRA;0000-00-00 00:00:00;0000-00-00 00:00:00;72
493;A-02-01-01-002-002;SUBMARINOS;0000-00-00 00:00:00;0000-00-00 00:00:00;73
494;A-02-01-01-002-003;AERONAVES MILITARES;0000-00-00 00:00:00;0000-00-00 00:00:00;74
495;A-02-01-01-002-004;TANQUES;0000-00-00 00:00:00;0000-00-00 00:00:00;75
496;A-02-01-01-002-005;DISPOSITIVOS DE TRANSPORTE;0000-00-00 00:00:00;0000-00-00 00:00:00;76
497;A-02-01-01-002-006;LANZA MISILES;0000-00-00 00:00:00;0000-00-00 00:00:00;77
498;A-02-01-01-002-007;OTROS SISTEMAS DE ARMAMENTO;0000-00-00 00:00:00;0000-00-00 00:00:00;78
499;A-02-01-01-003-008;MUEBLES, INSTRUMENTOS MUSICALES, ARTICULOS DE DEPORTE Y ANTIGEDADES;0000-00-00 00:00:00;0000-00-00 00:00:00;79
500;A-02-01-01-003-008-01;MUEBLES;0000-00-00 00:00:00;0000-00-00 00:00:00;79
501;A-02-01-01-003-008-01-1;ASIENTOS;0000-00-00 00:00:00;0000-00-00 00:00:00;79
502;A-02-01-01-003-008-01-2;MUEBLES, DEL TIPO UTILIZADO EN OFICINAS;0000-00-00 00:00:00;0000-00-00 00:00:00;79
503;A-02-01-01-003-008-01-3;MUEBLES DE MADERA, DEL TIPO UTILIZADO EN LA COCINA;0000-00-00 00:00:00;0000-00-00 00:00:00;79
504;A-02-01-01-003-008-01-4;OTROS MUEBLES N.C.P.;0000-00-00 00:00:00;0000-00-00 00:00:00;79
505;A-02-01-01-003-008-01-5;SOMIERES, COLCHONES CON MUELLES, RELLENOS O GUARNECIDOS INTERIORMENTE CON CUALQUIER MATERIAL, DE CAUCHO O PLASTICOS CELULARES, RECUBIERTOS O NO;0000-00-00 00:00:00;0000-00-00 00:00:00;79
506;A-02-01-01-003-008-01-6;PARTES Y PIEZAS DE MUEBLES;0000-00-00 00:00:00;0000-00-00 00:00:00;79
507;A-02-01-01-003-008-03;INSTRUMENTOS MUSICALES;0000-00-00 00:00:00;0000-00-00 00:00:00;79
508;A-02-01-01-003-008-04;ARTICULOS DE DEPORTE;0000-00-00 00:00:00;0000-00-00 00:00:00;79
509;A-02-01-01-003-008-09;ANTIGEDADES U OTROS OBJETOS DE ARTE;0000-00-00 00:00:00;0000-00-00 00:00:00;79
510;A-02-01-01-004-003;MAQUINARIA PARA USO GENERAL;0000-00-00 00:00:00;0000-00-00 00:00:00;80
511;A-02-01-01-004-003-01;MOTORES Y TURBINAS Y SUS PARTES;0000-00-00 00:00:00;0000-00-00 00:00:00;80
512;A-02-01-01-004-003-02;BOMBAS, COMPRESORES, MOTORES DE FUERZA HIDRAULICA Y MOTORES DE POTENCIA NEUMATICA Y VALVULAS Y SUS PARTES Y PIEZAS;0000-00-00 00:00:00;0000-00-00 00:00:00;80
513;A-02-01-01-004-003-03;COJINETES, ENGRANAJES, RUEDAS DE FRICCION Y ELEMENTOS DE TRANSMISION Y SUS PARTES Y PIEZAS;0000-00-00 00:00:00;0000-00-00 00:00:00;80
514;A-02-01-01-004-003-04;HORNOS Y QUEMADORES PARA ALIMENTACION DE HOGARES Y SUS PARTES Y PIEZAS;0000-00-00 00:00:00;0000-00-00 00:00:00;80
515;A-02-01-01-004-003-05;EQUIPO DE ELEVACION Y MANIPULACION Y SUS PARTES Y PIEZAS;0000-00-00 00:00:00;0000-00-00 00:00:00;80
516;A-02-01-01-004-003-09;OTRAS MAQUINAS PARA USOS GENERALES Y SUS PARTES Y PIEZAS;0000-00-00 00:00:00;0000-00-00 00:00:00;80
517;A-02-01-01-004-004;MAQUINARIA PARA USOS ESPECIALES;0000-00-00 00:00:00;0000-00-00 00:00:00;81
518;A-02-01-01-004-004-01;MAQUINARIA AGROPECUARIA O SILVICOLA Y SUS PARTES Y PIEZAS;0000-00-00 00:00:00;0000-00-00 00:00:00;81
519;A-02-01-01-004-004-02;MAQUINAS HERRAMIENTAS Y SUS PARTES, PIEZAS Y ACCESORIOS;0000-00-00 00:00:00;0000-00-00 00:00:00;81
520;A-02-01-01-004-004-03;MAQUINARIA PARA LA INDUSTRIA METALURGICA Y SUS PARTES Y PIEZAS;0000-00-00 00:00:00;0000-00-00 00:00:00;81
521;A-02-01-01-004-004-04;MAQUINARIA PARA LA MINERIA, LA EXPLOTACION DE CANTERAS Y LA CONSTRUCCION Y SUS PARTES Y PIEZAS;0000-00-00 00:00:00;0000-00-00 00:00:00;81
522;A-02-01-01-004-004-05;MAQUINARIA PARA LA ELABORACION DE ALIMENTOS, BEBIDAS Y TABACO, Y SUS PARTES Y PIEZAS;0000-00-00 00:00:00;0000-00-00 00:00:00;81
523;A-02-01-01-004-004-06;MAQUINARIA PARA LA FABRICACION DE TEXTILES, PRENDAS DE VESTIR Y ARTICULOS DE CUERO, Y SUS PARTES Y PIEZAS;0000-00-00 00:00:00;0000-00-00 00:00:00;81
524;A-02-01-01-004-004-08;APARATOS DE USO DOMESTICO Y SUS PARTES Y PIEZAS;0000-00-00 00:00:00;0000-00-00 00:00:00;81
525;A-02-01-01-004-004-09;OTRA MAQUINARIA PARA USOS ESPECIALES Y SUS PARTES Y PIEZAS;0000-00-00 00:00:00;0000-00-00 00:00:00;81
526;A-02-01-01-004-005;MAQUINARIA DE OFICINA, CONTABILIDAD E INFORMATICA;0000-00-00 00:00:00;0000-00-00 00:00:00;82
527;A-02-01-01-004-005-01;MAQUINAS PARA OFICINA Y CONTABILIDAD, Y SUS PARTES Y ACCESORIOS;0000-00-00 00:00:00;0000-00-00 00:00:00;82
528;A-02-01-01-004-005-02;MAQUINARIA DE INFORMATICA Y SUS PARTES, PIEZAS Y ACCESORIOS;0000-00-00 00:00:00;0000-00-00 00:00:00;82
529;A-02-01-01-004-006;MAQUINARIA Y APARATOS ELECTRICOS;0000-00-00 00:00:00;0000-00-00 00:00:00;83
530;A-02-01-01-004-006-01;MOTORES, GENERADORES Y TRANSFORMADORES ELECTRICOS Y SUS PARTES Y PIEZAS;0000-00-00 00:00:00;0000-00-00 00:00:00;83
531;A-02-01-01-004-006-02;APARATOS DE CONTROL ELECTRICO Y DISTRIBUCION DE ELECTRICIDAD Y SUS PARTES Y PIEZAS;0000-00-00 00:00:00;0000-00-00 00:00:00;83
532;A-02-01-01-004-006-03;HILOS Y CABLES AISLADOS CABLE DE FIBRA OPTICA;0000-00-00 00:00:00;0000-00-00 00:00:00;83
533;A-02-01-01-004-006-04;ACUMULADORES, PILAS Y BATERIAS PRIMARIAS Y SUS PARTES Y PIEZAS;0000-00-00 00:00:00;0000-00-00 00:00:00;83
534;A-02-01-01-004-006-05;LAMPARAS ELECTRICAS DE INCANDESCENCIA O DESCARGA LAMPARAS DE ARCO, EQUIPO PARA ALUMBRADO ELECTRICO SUS PARTES Y PIEZAS;0000-00-00 00:00:00;0000-00-00 00:00:00;83
535;A-02-01-01-004-006-09;OTRO EQUIPO ELECTRICO Y SUS PARTES Y PIEZAS;0000-00-00 00:00:00;0000-00-00 00:00:00;83
536;A-02-01-01-004-007;EQUIPO Y APARATOS DE RADIO, TELEVISION Y COMUNICACIONES;0000-00-00 00:00:00;0000-00-00 00:00:00;84
537;A-02-01-01-004-007-01;VALVULAS Y TUBOS ELECTRONICOS COMPONENTES ELECTRONICOS SUS PARTES Y PIEZAS;0000-00-00 00:00:00;0000-00-00 00:00:00;84
538;A-02-01-01-004-007-02;APARATOS TRANSMISORES DE TELEVISION Y RADIO TELEVISION, VIDEO Y CAMARAS DIGITALES TELEFONOS;0000-00-00 00:00:00;0000-00-00 00:00:00;84
539;A-02-01-01-004-007-03;RADIORRECEPTORES Y RECEPTORES DE TELEVISION APARATOS PARA LA GRABACION Y REPRODUCCION DE SONIDO Y VIDEO MICROFONOS, ALTAVOCES, AMPLIFICADORES, ETC.;0000-00-00 00:00:00;0000-00-00 00:00:00;84
540;A-02-01-01-004-007-04;PARTES Y PIEZAS DE LOS PRODUCTOS DE LAS CLASES 4721 A 4733 Y 4822;0000-00-00 00:00:00;0000-00-00 00:00:00;84
541;A-02-01-01-004-007-05;DISCOS, CINTAS, DISPOSITIVOS DE ALMACENAMIENTO EN ESTADO SOLIDO NO VOLATILES Y OTROS MEDIOS, NO GRABADOS;0000-00-00 00:00:00;0000-00-00 00:00:00;84
542;A-02-01-01-004-007-06;GRABACIONES DE AUDIO, VIDEO Y OTROS DISCOS, CINTAS Y OTROS MEDIOS FISICOS;0000-00-00 00:00:00;0000-00-00 00:00:00;84
543;A-02-01-01-004-007-09;TARJETAS CON BANDAS MAGNETICAS O PLAQUETAS (CHIP);0000-00-00 00:00:00;0000-00-00 00:00:00;84
544;A-02-01-01-004-008;APARATOS MEDICOS, INSTRUMENTOS OPTICOS Y DE PRECISION, RELOJES;0000-00-00 00:00:00;0000-00-00 00:00:00;85
545;A-02-01-01-004-008-01;APARATOS MEDICOS Y QUIRURGICOS Y APARATOS ORTESICOS Y PROTESICOS;0000-00-00 00:00:00;0000-00-00 00:00:00;85
546;A-02-01-01-004-008-02;INSTRUMENTOS Y APARATOS DE MEDICION, VERIFICACION, ANALISIS, DE NAVEGACION Y PARA OTROS FINES (EXCEPTO INSTRUMENTOS OPTICOS) INSTRUMENTOS DE CONTROL DE PROCESOS INDUSTRIALES, SUS PARTES, PIEZAS Y ACCESORIOS;0000-00-00 00:00:00;0000-00-00 00:00:00;85
547;A-02-01-01-004-008-03;INSTRUMENTOS OPTICOS Y EQUIPO FOTOGRAFICO PARTES, PIEZAS Y ACCESORIOS;0000-00-00 00:00:00;0000-00-00 00:00:00;85
548;A-02-01-01-004-008-04;RELOJES Y SUS PARTES Y PIEZAS;0000-00-00 00:00:00;0000-00-00 00:00:00;85
549;A-02-01-01-004-009;EQUIPO DE TRANSPORTE;0000-00-00 00:00:00;0000-00-00 00:00:00;86
550;A-02-01-01-004-009-01;VEHICULOS AUTOMOTORES, REMOLQUES Y SEMIRREMOLQUES Y SUS PARTES, PIEZAS Y ACCESORIOS;0000-00-00 00:00:00;0000-00-00 00:00:00;86
551;A-02-01-01-004-009-02;CARROCERIAS (INCLUSO CABINAS) PARA VEHICULOS AUTOMOTORES REMOLQUES Y SEMIRREMOLQUES Y SUS PARTES, PIEZAS Y ACCESORIOS;0000-00-00 00:00:00;0000-00-00 00:00:00;86
552;A-02-01-01-004-009-03;BUQUES;0000-00-00 00:00:00;0000-00-00 00:00:00;86
553;A-02-01-01-004-009-04;EMBARCACIONES PARA DEPORTES Y RECREO;0000-00-00 00:00:00;0000-00-00 00:00:00;86
554;A-02-01-01-004-009-05;LOCOMOTORAS Y MATERIAL RODANTE DE FERROCARRIL Y TRANVIA, Y SUS PARTES Y PIEZAS;0000-00-00 00:00:00;0000-00-00 00:00:00;86
555;A-02-01-01-004-009-06;AERONAVES Y NAVES ESPACIALES, Y SUS PARTES Y PIEZAS;0000-00-00 00:00:00;0000-00-00 00:00:00;86
556;A-02-01-01-004-009-09;OTRO EQUIPO DE TRANSPORTE, Y SUS PARTES Y PIEZAS;0000-00-00 00:00:00;0000-00-00 00:00:00;86
557;A-02-01-01-004-009-09-1;MOTOCICLETAS Y SIDECARES (VEHICULOS LATERALES A LAS MOTOCICLETAS);0000-00-00 00:00:00;0000-00-00 00:00:00;86
558;A-02-01-01-004-009-09-2;BICICLETAS Y SILLONES DE RUEDAS PARA DISCAPACITADOS;0000-00-00 00:00:00;0000-00-00 00:00:00;86
559;A-02-01-01-004-009-09-3;VEHICULOS N.C.P. SIN PROPULSION MECANICA;0000-00-00 00:00:00;0000-00-00 00:00:00;86
560;A-02-01-01-004-009-09-4;PARTES Y PIEZAS PARA LOS PRODUCTOS DE LAS CLASES 4991 Y 4992;0000-00-00 00:00:00;0000-00-00 00:00:00;86
561;A-02-01-01-004-010;EQUIPO MILITAR Y POLICIA;0000-00-00 00:00:00;0000-00-00 00:00:00;87
562;A-02-01-01-004-010-01;ARMAS;0000-00-00 00:00:00;0000-00-00 00:00:00;87
563;A-02-01-01-004-010-02;EQUIPO DE ALOJAMIENTO Y CAMPANA;0000-00-00 00:00:00;0000-00-00 00:00:00;87
564;A-02-01-01-004-010-03;EQUIPO DE INTELIGENCIA;0000-00-00 00:00:00;0000-00-00 00:00:00;87
565;A-02-01-01-004-010-04;EQUIPO MILITAR Y DE SEGURIDAD;0000-00-00 00:00:00;0000-00-00 00:00:00;87
566;A-02-01-01-004-010-05;EQUIPO POLICIA JUDICIAL;0000-00-00 00:00:00;0000-00-00 00:00:00;87
567;A-02-01-01-004-010-06;EQUIPO ANTIMOTINES;0000-00-00 00:00:00;0000-00-00 00:00:00;87
568;A-02-01-01-004-010-07;OTROS EQUIPOS;0000-00-00 00:00:00;0000-00-00 00:00:00;87
569;A-02-01-01-006-001;RECURSOS BIOLOGICOS CULTIVADOS;0000-00-00 00:00:00;0000-00-00 00:00:00;88
570;A-02-01-01-006-001-01;RECURSOS ANIMALES QUE GENERAN PRODUCTOS EN FORMA REPETIDA;0000-00-00 00:00:00;0000-00-00 00:00:00;88
571;A-02-01-01-006-001-01-1;ANIMALES DE CRIA;0000-00-00 00:00:00;0000-00-00 00:00:00;88
572;A-02-01-01-006-001-01-2;GANADO LECHERO;0000-00-00 00:00:00;0000-00-00 00:00:00;88
573;A-02-01-01-006-001-01-3;ANIMALES DE TIRO;0000-00-00 00:00:00;0000-00-00 00:00:00;88
574;A-02-01-01-006-001-01-4;ANIMALES UTILIZADOS PARA LA PRODUCCION DE LANA;0000-00-00 00:00:00;0000-00-00 00:00:00;88
575;A-02-01-01-006-001-01-5;ANIMALES EMPLEADOS PARA EL TRANSPORTE;0000-00-00 00:00:00;0000-00-00 00:00:00;88
576;A-02-01-01-006-001-01-6;ANIMALES EMPLEADOS PARA LAS CARRETAS;0000-00-00 00:00:00;0000-00-00 00:00:00;88
577;A-02-01-01-006-001-01-7;ANIMALES EMPLEADOS PARA EL ESPARCIMIENTO;0000-00-00 00:00:00;0000-00-00 00:00:00;88
578;A-02-01-01-006-001-01-8;OTROS ANIMALES QUE GENERAN PRODUCTOS EN FORMA REPETIDA;0000-00-00 00:00:00;0000-00-00 00:00:00;88
579;A-02-01-01-006-001-02;ARBOLES, CULTIVOS Y PLANTAS QUE GENERAN PRODUCTOS EN FORMA REPETIDA;0000-00-00 00:00:00;0000-00-00 00:00:00;88
580;A-02-01-01-006-001-02-1;ARBOLES FRUTALES;0000-00-00 00:00:00;0000-00-00 00:00:00;88
581;A-02-01-01-006-001-02-2;ARBOLES CULTIVADOS POR SUS NUECES;0000-00-00 00:00:00;0000-00-00 00:00:00;88
582;A-02-01-01-006-001-02-3;ARBOLES CULTIVADOS POR SU SAVIA;0000-00-00 00:00:00;0000-00-00 00:00:00;88
583;A-02-01-01-006-001-02-4;ARBOLES CULTIVADOS POR SU RESINA;0000-00-00 00:00:00;0000-00-00 00:00:00;88
584;A-02-01-01-006-001-02-5;ARBOLES CULTIVADOS POR SU CORTEZA U HOJAS;0000-00-00 00:00:00;0000-00-00 00:00:00;88
585;A-02-01-01-006-001-02-6;OTROS ARBOLES, CULTIVOS Y PLANTAS QUE GENERAN PRODUCTOS EN FORMA REPETIDA;0000-00-00 00:00:00;0000-00-00 00:00:00;88
586;A-02-01-01-006-002;PRODUCTOS DE LA PROPIEDAD INTELECTUAL;0000-00-00 00:00:00;0000-00-00 00:00:00;89
587;A-02-01-01-006-002-01;INVESTIGACION Y DESARROLLO;0000-00-00 00:00:00;0000-00-00 00:00:00;89
588;A-02-01-01-006-002-02;EXPLOTACION Y EVALUACION MINERA;0000-00-00 00:00:00;0000-00-00 00:00:00;89
589;A-02-01-01-006-002-02-1;COSTOS DE LAS PERFORACIONES DE PRUEBA Y SONDEO REALIZADAS;0000-00-00 00:00:00;0000-00-00 00:00:00;89
590;A-02-01-01-006-002-02-2;COSTOS DE PRECALIFICACION;0000-00-00 00:00:00;0000-00-00 00:00:00;89
591;A-02-01-01-006-002-02-3;OBTENCION DE LICENCIAS, ADQUISICION Y AVALUOS;0000-00-00 00:00:00;0000-00-00 00:00:00;89
592;A-02-01-01-006-002-02-4;COSTOS DE TRANSPORTE;0000-00-00 00:00:00;0000-00-00 00:00:00;89
593;A-02-01-01-006-002-02-5;OTROS COSTOS DE EVALUACION Y EXPLOTACION MINERA;0000-00-00 00:00:00;0000-00-00 00:00:00;89
594;A-02-01-01-006-002-03;PROGRAMAS DE INFORMATICA Y BASES DE DATOS;0000-00-00 00:00:00;0000-00-00 00:00:00;89
595;A-02-01-01-006-002-03-1;PROGRAMAS DE INFORMATICA;0000-00-00 00:00:00;0000-00-00 00:00:00;89
596;A-02-01-01-006-002-03-1-01;PAQUETES DE SOFTWARE;0000-00-00 00:00:00;0000-00-00 00:00:00;89
597;A-02-01-01-006-002-03-2;BASES DE DATOS;0000-00-00 00:00:00;0000-00-00 00:00:00;89
598;A-02-01-01-006-002-03-2-02;GASTOS DE DESARROLLO;0000-00-00 00:00:00;0000-00-00 00:00:00;89
599;A-02-01-01-006-002-04;ORIGINALES DE ENTRETENIMIENTO, LITERATURA Y ARTE;0000-00-00 00:00:00;0000-00-00 00:00:00;89
600;A-02-01-01-006-002-05;OTROS PRODUCTOS DE PROPIEDAD INTELECTUAL;0000-00-00 00:00:00;0000-00-00 00:00:00;89
